{
    "allowedTrailers": [
        {
            "id_location": 1,
            "id_trailer": 0
        },
        {
            "id_location": 1,
            "id_trailer": 1
        }
    ],
    "bases": [
        {
            "index": 0
        }
    ],
    "customers": [
        {
            "Capacity": 52000,
            "InitialTankQuantity": 19000,
            "LayoverCustomer": 0,
            "MinOperationQuantity": 0,
            "SafetyLevel": 10400,
            "callIn": 0,
            "index": 2,
            "setupTime": 30
        },
        {
            "Capacity": 120000,
            "InitialTankQuantity": 39297,
            "LayoverCustomer": 0,
            "MinOperationQuantity": 0,
            "SafetyLevel": 24000,
            "callIn": 0,
            "index": 3,
            "setupTime": 30
        },
        {
            "Capacity": 6000,
            "InitialTankQuantity": 1800,
            "LayoverCustomer": 0,
            "MinOperationQuantity": 0,
            "SafetyLevel": 1200,
            "callIn": 0,
            "index": 4,
            "setupTime": 30
        },
        {
            "Capacity": 9000,
            "InitialTankQuantity": 1866,
            "LayoverCustomer": 0,
            "MinOperationQuantity": 0,
            "SafetyLevel": 1800,
            "callIn": 0,
            "index": 5,
            "setupTime": 30
        },
        {
            "Capacity": 6000,
            "InitialTankQuantity": 5238,
            "LayoverCustomer": 0,
            "MinOperationQuantity": 0,
            "SafetyLevel": 1200,
            "callIn": 0,
            "index": 6,
            "setupTime": 30
        },
        {
            "Capacity": 20000,
            "InitialTankQuantity": 5638,
            "LayoverCustomer": 0,
            "MinOperationQuantity": 0,
            "SafetyLevel": 4000,
            "callIn": 0,
            "index": 7,
            "setupTime": 30
        },
        {
            "Capacity": 6000,
            "InitialTankQuantity": 1967,
            "LayoverCustomer": 0,
            "MinOperationQuantity": 0,
            "SafetyLevel": 1200,
            "callIn": 0,
            "index": 8,
            "setupTime": 30
        },
        {
            "Capacity": 6000,
            "InitialTankQuantity": 5035,
            "LayoverCustomer": 0,
            "MinOperationQuantity": 0,
            "SafetyLevel": 1200,
            "callIn": 0,
            "index": 9,
            "setupTime": 30
        },
        {
            "Capacity": 18000,
            "InitialTankQuantity": 6498,
            "LayoverCustomer": 0,
            "MinOperationQuantity": 0,
            "SafetyLevel": 3600,
            "callIn": 0,
            "index": 10,
            "setupTime": 30
        },
        {
            "Capacity": 12000,
            "InitialTankQuantity": 5523,
            "LayoverCustomer": 0,
            "MinOperationQuantity": 0,
            "SafetyLevel": 1500,
            "callIn": 0,
            "index": 11,
            "setupTime": 30
        },
        {
            "Capacity": 38000,
            "InitialTankQuantity": 21000,
            "LayoverCustomer": 0,
            "MinOperationQuantity": 0,
            "SafetyLevel": 7600,
            "callIn": 0,
            "index": 12,
            "setupTime": 30
        },
        {
            "Capacity": 15000,
            "InitialTankQuantity": 6828,
            "LayoverCustomer": 0,
            "MinOperationQuantity": 0,
            "SafetyLevel": 3000,
            "callIn": 0,
            "index": 13,
            "setupTime": 30
        }
    ],
    "customersTimeWindows": [
        {
            "end": 43199,
            "id_customer": 2,
            "start": 0
        },
        {
            "end": 43199,
            "id_customer": 3,
            "start": 0
        },
        {
            "end": 43199,
            "id_customer": 4,
            "start": 0
        },
        {
            "end": 43199,
            "id_customer": 5,
            "start": 0
        },
        {
            "end": 43199,
            "id_customer": 6,
            "start": 0
        },
        {
            "end": 43199,
            "id_customer": 7,
            "start": 0
        },
        {
            "end": 43199,
            "id_customer": 8,
            "start": 0
        },
        {
            "end": 43199,
            "id_customer": 9,
            "start": 0
        },
        {
            "end": 43199,
            "id_customer": 10,
            "start": 0
        },
        {
            "end": 43199,
            "id_customer": 11,
            "start": 0
        },
        {
            "end": 43199,
            "id_customer": 12,
            "start": 0
        },
        {
            "end": 43199,
            "id_customer": 13,
            "start": 0
        }
    ],
    "drivers": [
        {
            "LayoverCost": 0,
            "LayoverDuration": 900,
            "TimeCost": 0,
            "index": 0,
            "maxDrivingDuration": 900,
            "minInterSHIFTDURATION": 600
        },
        {
            "LayoverCost": 0,
            "LayoverDuration": 900,
            "TimeCost": 0,
            "index": 1,
            "maxDrivingDuration": 900,
            "minInterSHIFTDURATION": 600
        }
    ],
    "driversTimeWindows": [
        {
            "end": 1320,
            "id_driver": 0,
            "start": 420
        },
        {
            "end": 2760,
            "id_driver": 0,
            "start": 1860
        },
        {
            "end": 4200,
            "id_driver": 0,
            "start": 3300
        },
        {
            "end": 5640,
            "id_driver": 0,
            "start": 4740
        },
        {
            "end": 7080,
            "id_driver": 0,
            "start": 6180
        },
        {
            "end": 8520,
            "id_driver": 0,
            "start": 7620
        },
        {
            "end": 9960,
            "id_driver": 0,
            "start": 9060
        },
        {
            "end": 11400,
            "id_driver": 0,
            "start": 10500
        },
        {
            "end": 12840,
            "id_driver": 0,
            "start": 11940
        },
        {
            "end": 14280,
            "id_driver": 0,
            "start": 13380
        },
        {
            "end": 15720,
            "id_driver": 0,
            "start": 14820
        },
        {
            "end": 17160,
            "id_driver": 0,
            "start": 16260
        },
        {
            "end": 18600,
            "id_driver": 0,
            "start": 17700
        },
        {
            "end": 20040,
            "id_driver": 0,
            "start": 19140
        },
        {
            "end": 21480,
            "id_driver": 0,
            "start": 20580
        },
        {
            "end": 22920,
            "id_driver": 0,
            "start": 22020
        },
        {
            "end": 24360,
            "id_driver": 0,
            "start": 23460
        },
        {
            "end": 25800,
            "id_driver": 0,
            "start": 24900
        },
        {
            "end": 27240,
            "id_driver": 0,
            "start": 26340
        },
        {
            "end": 28680,
            "id_driver": 0,
            "start": 27780
        },
        {
            "end": 30120,
            "id_driver": 0,
            "start": 29220
        },
        {
            "end": 31560,
            "id_driver": 0,
            "start": 30660
        },
        {
            "end": 33000,
            "id_driver": 0,
            "start": 32100
        },
        {
            "end": 34440,
            "id_driver": 0,
            "start": 33540
        },
        {
            "end": 35880,
            "id_driver": 0,
            "start": 34980
        },
        {
            "end": 37320,
            "id_driver": 0,
            "start": 36420
        },
        {
            "end": 38760,
            "id_driver": 0,
            "start": 37860
        },
        {
            "end": 40200,
            "id_driver": 0,
            "start": 39300
        },
        {
            "end": 41640,
            "id_driver": 0,
            "start": 40740
        },
        {
            "end": 43080,
            "id_driver": 0,
            "start": 42180
        },
        {
            "end": 1320,
            "id_driver": 1,
            "start": 420
        },
        {
            "end": 2760,
            "id_driver": 1,
            "start": 1860
        },
        {
            "end": 4200,
            "id_driver": 1,
            "start": 3300
        },
        {
            "end": 5640,
            "id_driver": 1,
            "start": 4740
        },
        {
            "end": 7080,
            "id_driver": 1,
            "start": 6180
        },
        {
            "end": 8520,
            "id_driver": 1,
            "start": 7620
        },
        {
            "end": 9960,
            "id_driver": 1,
            "start": 9060
        },
        {
            "end": 11400,
            "id_driver": 1,
            "start": 10500
        },
        {
            "end": 12840,
            "id_driver": 1,
            "start": 11940
        },
        {
            "end": 14280,
            "id_driver": 1,
            "start": 13380
        },
        {
            "end": 15720,
            "id_driver": 1,
            "start": 14820
        },
        {
            "end": 17160,
            "id_driver": 1,
            "start": 16260
        },
        {
            "end": 18600,
            "id_driver": 1,
            "start": 17700
        },
        {
            "end": 20040,
            "id_driver": 1,
            "start": 19140
        },
        {
            "end": 21480,
            "id_driver": 1,
            "start": 20580
        },
        {
            "end": 22920,
            "id_driver": 1,
            "start": 22020
        },
        {